{
  "classification": "high",
  "computed_at": "2026-09-01T17:54:19.423505+00:00",
  "performance": {
    "change_failure_rate": {
      "cfr_pct": 8.6,
      "deploy_count": 93,
      "details": [
        {
          "error_snippet": "RuntimeError: HTTP 429: Token Plan usage limit reached: Upgrade your Token Plan or purchase Credits for more usage. (205",
          "last_run_at": "2026-08-30T18:00:58.903202+00:00",
          "name": "thesis-weekly-review",
          "schedule": "0 18 * * 0"
        },
        {
          "error_snippet": "RuntimeError: HTTP 429: Token Plan usage limit reached: Upgrade your Token Plan or purchase Credits for more usage. (205",
          "last_run_at": "2026-08-30T23:00:30.602684+00:00",
          "name": "thesis-git-maintenance",
          "schedule": "0 23 * * 0"
        },
        {
          "error_snippet": "RuntimeError: HTTP 429: Token Plan usage limit reached: Upgrade your Token Plan or purchase Credits for more usage. (205",
          "last_run_at": "2026-08-30T21:00:56.056261+00:00",
          "name": "aiw-research-tracker-weekly",
          "schedule": "30 20 * * 0"
        },
        {
          "error_snippet": "RuntimeError: HTTP 429: Token Plan usage limit reached: Upgrade your Token Plan or purchase Credits for more usage. (205",
          "last_run_at": "2026-08-30T21:01:17.941691+00:00",
          "name": "aiw-coach-ivan",
          "schedule": "0 21 * * 0"
        },
        {
          "error_snippet": "RuntimeError: HTTP 429: Token Plan usage limit reached: Upgrade your Token Plan or purchase Credits for more usage. (205",
          "last_run_at": "2026-08-30T19:00:30.247363+00:00",
          "name": "aiw-tax-receipt-tracker-weekly",
          "schedule": "30 19 * * 0"
        },
        {
          "error_snippet": "RuntimeError: HTTP 429: Token Plan usage limit reached: Upgrade your Token Plan or purchase Credits for more usage. (205",
          "last_run_at": "2026-08-30T20:00:38.813254+00:00",
          "name": "aiw-founder-bandwidth-watchdog-weekly",
          "schedule": "0 20 * * 0"
        },
        {
          "error_snippet": "Script not found: /opt/data/scripts/linkedin-token-refresh.sh",
          "last_run_at": "2026-08-26T09:00:36.002367+00:00",
          "name": "linkedin-token-refresh",
          "schedule": "0 9 * * *"
        },
        {
          "error_snippet": "Script not found: /opt/data/scripts/instagram-token-refresh.sh",
          "last_run_at": "2026-08-26T09:31:51.431866+00:00",
          "name": "instagram-token-refresh",
          "schedule": "30 9 * * *"
        }
      ],
      "incidents_in_window": 8,
      "source": "computed"
    },
    "deploy_frequency": {
      "deploy_count": 93,
      "deploys_per_week": 23.25,
      "first_deploy_at": "2026-08-17T12:06:03+00:00",
      "last_deploy_at": "2026-09-01T16:46:44+00:00",
      "lead_time_hours_avg": 0.13,
      "source": "git-commit-count-master"
    },
    "lead_time": {
      "deploy_count": 93,
      "deploys_per_week": 23.25,
      "first_deploy_at": "2026-08-17T12:06:03+00:00",
      "last_deploy_at": "2026-09-01T16:46:44+00:00",
      "lead_time_hours_avg": 0.13,
      "source": "git-commit-count-master"
    },
    "mttr": {
      "mttr_minutes": null,
      "samples": 0,
      "source": "incidents-need-resolved-at"
    }
  },
  "summary": {
    "change_failure_rate_pct": 8.6,
    "deploy_frequency_label": "on-demand",
    "deploys_per_week": 23.25,
    "lead_time_hours_avg": 0.13,
    "mttr_minutes": null
  },
  "version": "1.0.0",
  "window_days": 28
}
